{
  "schema_version": "1.0.0",
  "id": "atlas.output-contract.2026-08-07",
  "catalog_version": "2026.08.07",
  "purpose": "One repository-owned denominator for UI export names and deterministic release members.",
  "members": [
    {
      "id": "output.private-site", "label": "Private interactive Atlas", "manifest_member": null, "emission": "external", "ui_surface": true, "gate": "private-deployment-required",
      "dossier": {"audience": ["repository owner", "authorized private reviewers"], "decision_supported": "Navigate the exact-source reference privately and decide whether a candidate is ready for owner acceptance.", "inputs": ["verified static site build", "served-hash comparison", "owner-only access policy"], "owner_refs": ["owner.reference.contract", "owner.repository.privacy"], "producing_writer": {"state": "external", "path": null, "symbol": null}, "gate_behavior": "Never emitted by the release builder; deployment and served-hash verification require separate owner authority.", "redaction": "Only repository-approved client-free reference bytes may be hosted; deployment adds no evidence intake.", "cross_artifact_ids": ["output.executive-html", "output.release-manifest", "output.artifact-inventory"], "validation": ["private access check", "served-byte digest reconciliation", "CSP and no-runtime-egress checks"], "distribution_inclusion": "external deployment only; not a release-manifest member", "safe_sample_status": "not-provided", "human_owned_evidence": ["private deployment authority not held by the builder", "served-hash verification receipt required"], "limitations": ["hosting availability and access controls are external state", "public publication is a separate prohibited-by-default decision"]}
    },
    {
      "id": "output.reference-json", "label": "Machine-readable corpus", "manifest_member": "atlas-reference.json", "emission": "always", "ui_surface": true, "gate": "compiler-backed",
      "dossier": {"audience": ["automation consumers", "engineers", "independent reviewers"], "decision_supported": "Query the curated reference and exact-source compiler summaries without scraping presentation formats.", "inputs": ["validated compiler bundle", "curated content bundle", "SBOM", "release status"], "owner_refs": ["owner.reference.contract", "owner.ssot.registry", "owner.manifest"], "producing_writer": {"state": "current", "path": "master-reference/release/documents.py", "symbol": "machine_reference"}, "gate_behavior": "Emitted only after compiler, content, schema, privacy, and exact-source bindings validate; remains preview until release gates pass.", "redaction": "Contains safe reference metadata and compiler summaries, not restricted source text or client evidence.", "cross_artifact_ids": ["output.provenance", "output.artifact-inventory", "output.release-manifest"], "validation": ["canonical JSON encoding", "content and compiler schema validation", "artifact digest receipt"], "distribution_inclusion": "primary release member; copied into offline and preservation bundles", "safe_sample_status": "generated-preview", "human_owned_evidence": ["independent semantic review receipt required for verified status"], "limitations": ["machine readability does not imply behavioral verification", "restricted content remains opaque"]}
    },
    {
      "id": "output.owner-handbook", "label": "Owner handbook", "manifest_member": "owner-handbook.md", "emission": "always", "ui_surface": true, "gate": "compiler-backed",
      "dossier": {"audience": ["project owner", "product and governance leads"], "decision_supported": "Orient to purpose, protected constraints, outcomes, decisions, and safe next actions.", "inputs": ["validated compiler identity", "core outcomes and maturity", "gaps and decisions", "PDF and release status"], "owner_refs": ["owner.reference.contract", "owner.operating.doctrine"], "producing_writer": {"state": "current", "path": "master-reference/release/documents.py", "symbol": "owner_handbook"}, "gate_behavior": "Generated from canonical content; blocked from verified publication when source or independent-review gates fail.", "redaction": "Client-free narrative only; no raw evidence, vault content, credentials, or restricted source.", "cross_artifact_ids": ["output.capability-gap", "output.decisions-opportunities", "output.release-manifest"], "validation": ["deterministic text generation", "content reference validation", "artifact digest receipt"], "distribution_inclusion": "primary release member; included in offline and preservation bundles", "safe_sample_status": "generated-preview", "human_owned_evidence": ["owner acceptance of product and decision framing required"], "limitations": ["summary navigation is not the complete source dossier", "human decisions remain unresolved until their authority acts"]}
    },
    {
      "id": "output.engineering-dossier", "label": "Engineering dossier", "manifest_member": "engineering-dossier.md", "emission": "always", "ui_surface": true, "gate": "compiler-backed",
      "dossier": {"audience": ["engineers", "architects", "independent technical reviewers"], "decision_supported": "Inspect architecture, completeness, source understanding, proof gaps, and release boundaries before change.", "inputs": ["compiler records and completeness ledger", "architecture contract", "invariants", "SBOM", "release status"], "owner_refs": ["owner.reference.contract", "owner.ssot.registry", "owner.distribution"], "producing_writer": {"state": "current", "path": "master-reference/release/documents.py", "symbol": "engineering_dossier"}, "gate_behavior": "Emitted as a source-bound dossier; unresolved parser, runtime, test, or review depth remains blocking or explicit.", "redaction": "Safe metadata and excerpts only; restricted files stay digest-only.", "cross_artifact_ids": ["output.source-index-json", "output.sbom", "output.provenance"], "validation": ["deterministic text generation", "compiler-ledger reconciliation", "artifact digest receipt"], "distribution_inclusion": "primary release member; included in offline and preservation bundles", "safe_sample_status": "generated-preview", "human_owned_evidence": ["critical/public symbol review receipts may still be required"], "limitations": ["static dossiers do not establish runtime behavior", "coverage percentages are not correctness proof"]}
    },
    {
      "id": "output.source-index-json", "label": "Whole-repository source and symbol index", "manifest_member": "source-symbol-index.json", "emission": "always", "ui_surface": true, "gate": "compiler-backed",
      "dossier": {"audience": ["engineers", "agents", "auditors"], "decision_supported": "Resolve any tracked path or symbol to its stable exact-tree record and lazy source location.", "inputs": ["validated compiler file, line, symbol, test, workflow, dataset, claim, and graph indexes"], "owner_refs": ["owner.reference.contract", "owner.ssot.registry"], "producing_writer": {"state": "current", "path": "master-reference/release/documents.py", "symbol": "source_symbol_index"}, "gate_behavior": "Fails with compiler/census mismatch; never synthesizes records for excluded or unreadable content.", "redaction": "Restricted paths expose classification and digest only; safe source remains in separate content-hashed chunks.", "cross_artifact_ids": ["output.source-index-markdown", "output.offline-zip", "output.preservation"], "validation": ["stable-ID uniqueness", "compiler count reconciliation", "canonical JSON and digest verification"], "distribution_inclusion": "primary release member; included in offline and preservation bundles", "safe_sample_status": "generated-preview", "human_owned_evidence": ["independent census review required for complete-accounting approval"], "limitations": ["index presence is structural proof, not Level-4 explanation", "dynamic runtime relationships can remain unresolved"]}
    },
    {
      "id": "output.source-index-markdown", "label": "Source and symbol index companion", "manifest_member": "source-symbol-index.md", "emission": "always", "ui_surface": false, "gate": "compiler-backed",
      "dossier": {"audience": ["human reviewers", "offline operators"], "decision_supported": "Locate source and symbol records in a text-only environment.", "inputs": ["source-symbol-index.json"], "owner_refs": ["owner.reference.contract"], "producing_writer": {"state": "current", "path": "master-reference/release/documents.py", "symbol": "source_symbol_markdown"}, "gate_behavior": "Generated only from the validated machine index; any mismatch fails release reconciliation.", "redaction": "Carries safe path and summary metadata, not restricted file contents.", "cross_artifact_ids": ["output.source-index-json", "output.offline-zip"], "validation": ["deterministic rendering from machine index", "artifact digest receipt"], "distribution_inclusion": "primary release member; included in offline and preservation bundles", "safe_sample_status": "generated-preview", "human_owned_evidence": ["no separate human proof beyond the machine-index review"], "limitations": ["text companion is intentionally less complete than machine records and Source Explorer"]}
    },
    {
      "id": "output.capability-gap", "label": "Capability and gap report", "manifest_member": "capability-gap-report.md", "emission": "always", "ui_surface": true, "gate": "compiler-backed",